News_title,Sentiment(MaxEntropy),Sentiment(VADER),Sentiment(SparkNLP)
"Swift digitalisation reforms needed to survive, says MDEC, SHRDC and Plus Solar",1,1,0
MDEC helps SMEs make a digital leap in the new norm - Director,1,1,1
Not a Sin for the Chinese to Be Rich,1,1,0
Not a sin for the Chinese to be rich,1,1,0
MyExport provides export opportunity during pandemic,1,1,1
Two Malaysians resort to finding work outside their comfort zones due to Covid-19,1,1,0
Unpaid care work needs constant attention for the sake of the economy,1,1,0
The State of the Nation: Penjana: Restarting the economy and paving the way for reform,1,2,1
"Permanent business GENERATOR incentives, create jobs",1,1,1
GENERATORS; ONE STEP TO OVERCOME THE ECONOMIC CRISIS AND UNEMPLOYMENT,1,0,1
Anwar: MPs Should Have Been Allowed to Debate RM35B Penjana Plan,1,2,0
Anwar: MPs should have been allowed to debate RM35b Penjana plan for economic regeneration,1,2,0
Is it enough to advance a film with an Oscar-winning KPI?,1,2,1
Anwar: MPs should have been allowed to debate RM35b Penjana plan for economic regeneration,1,2,0
Assistance under the Prihatin package continues in line with the Generator,1,2,0
#PRIHATIN package assistance continues in line with #PENJANA - Tengku Zafrul,1,2,1
Assistance Under the PRIHATIN Package Will Continue In Line With GENERATORS,1,2,1
Assistance under the PRIHATIN package will continue in line with GENERATORS - Tengku Zafrul,1,2,1
PENJANA: RM9 billion allocation will help revive country's employment sector,1,1,1
Malaysian Employers Federation: RM9b Penjana allocation will help revive employment sector,1,1,1
PENJANA: The RM9 monthly fund is able to breathe new life into the country's employment sector,1,2,1
An inclusive approach to economic generation,1,2,1
"Toward a comprehensive, consistent economic recovery",1,1,1
PENJANA: RM9 bln allocation will help revive country's employment sector,1,1,1
"GENERATOR RM35 billion empowering the people, traders, stimulating the economy",1,1,0
What are your job prospects after Covid-19,1,1,1
"Covid-19: Comprehensive law for tenants, homeowners and banks needed, say Opposition lawmakers",1,1,1
"Changing the government is good, you can restart the economy from scratch - Expert",1,1,0
"It's not just the people who don't agree to change the government, economists also agree to remain Ms - People's Mind",1,0,0
Kingdom swaps allow economies to be rebuilt from scratch - economist,1,1,1
The culture of digitization helps PKS deal with the impact of Covid-19,1,1,1
"Covid–19: The Kingdom Has a Strategy, Prepares to Handle Poverty Situation",1,0,1
Job Creation Needs To Be A Priority In The Economic Recovery Plan,1,1,0
Job Creation Needs To Be A Priority In The Economic Recovery Plan,1,1,0
"Covid–19: The Kingdom Has a Strategy, Prepares to Handle Poverty Situation",1,0,1
"Department of Statistics Prepares New, Up-to-date More Detailed Statistics",1,2,1
Statistics Dept: Work Together To Strengthen Malaysia’s Socio–economic Position,1,1,1
Work Together To Strengthen The Country's Socio–economic Position –– Dosm,1,1,1
Covid–19 Can Be A Blessing In Disguise For Businesses,1,1,1
"Covid–19 Can Be A Blessing In Disguise For Businesses, Says Economist",1,1,0
The State's Socio-Economic Position Can Be Accelerated By Three Main Dimensions,1,2,1
Malaysia’s Gdp Grow By 0.7% In Q1,1,2,1
GDP growth of 0.7pct for first quarter of 2020 is lowest since 2009,1,2,0
Work together to strengthen the country's socio-economic position -- DOSM,1,1,1
The socio-economic position of the country can be improved by three main dimensions,1,1,1
Former Hr Minister Urges Pm To Announce Measures To Boost Employment And Save Businesses,1,1,1
"Almost A Million Will Lose Their Jobs This Year, Says The Employers' Association",1,0,1
Former HR minister urges PM to announce measures to boost employment and save businesses,1,1,1
Former Hr Minister Urges Pm To Announce Measures To Boost Employment And Save Businesses,1,1,1
Survey: Two In Five Firms Say Need At Least Six Months For Recovery Even If Covid–19 Contained,1,2,1
Survey: Two in five firms say need at least six months for recovery even if Covid-19 contained,1,2,1
Survey: Two In Five Firms Say Need At Least Six Months For Recovery Even If Covid–19 Contained,1,2,1
‘malaysians Love Property But …’,1,1,1
Urbanfutures: Building A Trust Economy | The Edge Markets,1,1,1
Department of Daily Wage Workers Sector Careful Statistics,1,1,1
"Channel More Help To Pks, Self Employed",1,1,0
Malaysia To Experience Short–term Benefit From China,1,1,1
Comprehensive Social Protection to Help the People,1,1,1
The Government's Correct Steps to Avoid the Unemployment Crisis,1,0,0
Move Will Help Smes To Retain Jobs: Minister,1,1,1
Additional SME Care Package can avoid unemployment,1,0,1
Additional Pks Care Package Able to Avoid Unemployment,1,0,1
"Precise, Comprehensive Extra Care Package",1,1,1
"Precise, Comprehensive Extra Care Package: Tok Mat",1,1,1
Proposed tax incentives to help SMEs,1,1,1
Proposed Tax Incentives To Help Pks,1,1,1
"Rm250bil Second Stimulus Package Should Help Tech Startups, Says Pikom Think Tank",1,1,1
Covid–19 & Mco: Tax Relief Proposals For Smes,1,1,1
Covid-19 & MCO: Tax relief proposals for SMEs,1,1,1
Covid–19 & Mco: Tax Relief Proposals For Smes | The Edge Markets,1,1,1
Covid–19 And Mco: Tax Relief Proposals For Smes — S. Saravana Kumar And Yap Wen Hui,1,1,1
Economic Stimulus Package Concerns the People: The Dilemma of Small and Medium Enterprises,1,0,1
Offer more assistance than loans to Small and Medium Enterprises - PSB,1,2,1
The Week Ahead: Focus On Who Will Become The Next Pm And Opr | The Edge Markets,1,2,1
Bsn Provides Smes Matching Grants To Digitalise Operations,1,1,1
'Ample room' to adjust monetary policy: Bank Negara governor,1,2,1
Pks Big Contributor of Income,1,2,1
Newsbreak: Seizing Opportunities Beyond The Rm30 E–wallet Credit | The Edge Markets,1,1,1
Bnm Interest Rate Drop: What Are The Effects And Effectiveness? – Shahril,1,1,1
"Strong Economic Fundamentals, Institutional Reforms Justify Moody's A3 Rating – Lim",1,1,1
Malaysia Gets High A3 Rating From Moody's Due To Solid Economic Fundamentals,1,1,1
The Week Ahead: Spotlight On World Economic Forum And Bank Negara’s First Opr Decision For 2020 | The Edge Markets,1,2,1
"Sabah's economic growth used to be the highest, now it is the lowest",1,2,1
"Sabah's economic growth used to be the highest, now it is the lowest",1,2,1
"From Highest, Warisan-ph Make Sabah's Growth Lowest - Najib",1,2,1
"#prkkimanis : Instead of being the highest, Warisan-ph makes Sabah's growth the lowest",1,2,1
Ready Towards a Cashless Society With People's E-cash,1,1,1
Many Hurdles Amid Great Growth,1,1,1
Ready Towards a Cashless Society With People's E-cash,1,1,1
‘malaysia’s Real Gdp Growth To Around 4.7 Pct For 2019’,1,1,1
"The Week Ahead: Eye On 1mdb Audit Case, Middle East Conflict And Signing Of Us–china Phase One Trade Deal | The Edge Markets",1,0,1
Lim: 2020 A Better Year For Malaysian Economy,1,1,1
Malaysia's Economy Likely To Better This Year: Mof,1,1,1
"Malaysia's Economy To Do Better In 2020, Says Guan Eng",1,1,1
Malaysia's Economy Expected to Grow Fast in 2020 - Guan Eng,1,2,1
Malaysian Economy Expected to Grow - Guan Eng,1,2,1
Malaysia’s Economy To Do Better In 2020 – Lim,1,1,1
Mega Project Stimulates Economic Growth This Year,1,1,1
Malaysian Economy Expected to Grow Fast - Guan Eng,1,2,1
Lge Upbeat On Economy After Malaysia's Purchasing Managers' Index Rises To 15–month High,1,2,1
Malaysia’s Economy To Do Better In 2020: Lim,1,1,1
Malaysia’s Economy To Do Better In 2020 – Lim,1,1,1
Lim: Malaysia's economy is expected to grow rapidly in 2020,1,2,1
Malaysia's economy is expected to grow rapidly in 2020: Guan Eng,1,2,1
Malaysia's Economy Expected to Grow Fast in 2020: Guan Eng,1,2,1
"Malaysia's Economy To Do Better In 2020, Says Guan Eng",1,1,1
"Malaysia's Forecast For Robust Growth In 2020 Backed By Data, Says Finance Minister",1,1,1
Malaysia's Economy Expected to Grow Fast in 2020 - Guan Eng,1,2,1
Malaysia's Economy To Do Better In 2020 – Lim,1,1,1
"Guan Eng Predicts Better Year Ahead With More Projects, Jobs",1,1,1
Malaysia's Economy Expected to Grow Fast in 2020 - Guan Eng,1,2,1
digitization of the country's economy benefits all - lim,2,1,1
malaysia on track towards developed nation status: statistics dept,2,2,1
malaysia on track towards developed nation status: dosm,2,2,1
Statistics Dept: Malaysia On Track Towards Developed Nation Status,2,2,1
service sector to achieve 60pct gdp contribution in 3 years,2,2,1
malaysia on track towards developed nation status,2,2,1
Tech Sector Hits Stride With Ample Support,2,1,1
tech sector hits stride with ample support from govt,2,1,1
tech sector hits stride with ample support from govt,2,1,1
"tech sector hits stride with ample support from govt, established players",2,1,1
"tech sector hits stride with ample support from govt, established players",2,1,1
2019 Is Deemed As The Year Of Pks Empowerment,2,2,1
2019 Is Deemed As The Year Of Pks Empowerment,2,2,1
Top 100 SMEs Defy Economic Headwinds to Post Triple-Digit Growth,2,1,1
state govt embarks on tourism master plan,2,2,1
95 tourism events included in state’s calendar of events 2020,2,2,1
"Bursa Seen To Trade In Tight Range, Investors Await Key Data",2,1,1
Sarawak Have Its Own Regional Tourism Satellite Account,2,2,1
Abdul Karim: State govt considering possibility of making Kuching an umrah hub,2,2,1
Sarawak has its own regional Tourism Satellite Account,2,2,1
Sarawak have its own regional tourism satellite account,2,2,1
Propertyguru Anticipates Glimmers Of Opportunity,2,1,1
VISION 20/20: PROPERTYGURU MARKET OUTLOOK,2,1,1
Malaysia's economy is expected to grow next January-March,2,2,1
study: 4 major things malaysians are worried about in 2019,2,0,0
"RCEP the realization of the rise of ASEAN, Asia",2,2,1
"Global players remain drawn to Malaysia's economy, strategic location - IQI chief economist",2,2,1
Bank Rakyat Focuses Efforts Towards Sustainability Seriously,2,0,1
bank rakyat takes sustainability efforts seriously,2,0,1
"Lim Guan Eng : Rm 800 Billion Debt , Ringgit Is Asia’s Worst Currency , 521 000 Unemployment , Klse Loses Rm157 Billion , 32,000 Retrenchment & Palm Oil From Rm800 To Rm 200",2,0,0
"RM1,200 minimum wage still below living wage in the Klang Valley | The Edge Markets",2,2,1
"RM1,200 minimum wage still below living wage in Klang Valley: Economists",2,2,0
"RM1,200 minimum wage still below living wage in the Klang valley",2,2,1
"RM1,200 minimum wage not nearly enough in Klang Valley, says economist",2,2,0
Muhammed Khalid: Developers should lower prices for unsold high-end homes,2,0,0
Focus on closing the disparity gap,2,2,0
Selangor receives the highest domestic visitor expenditure,2,2,1
Malaysia's FDI rises 10.3 pct to RM667. 5bil in Q2,2,2,1
"2Q GDP highest in five quarters, surprises market - analysts",2,1,1
"Q2 GDP highest in 5 quarters, surprises market -- Analysts",2,1,1
Social inclusion the Islamic way,2,2,1
Malaysia surprises sceptics over sovereign ratings,2,1,1
Nstleader: Business Matters,2,1,1
"census to cover 12,000 businesses",2,2,1
Give more access to financing for first-time homebuyers,2,2,1
"Give more access to financing for first-time homebuyers, govt tells banks",2,2,1
Malaysia recorded a current account surplus of RM16.4 billion,2,2,1
Malaysia's economy reaches RM1.45 trillion,2,1,1
"Economy rebased to 2015, GNI per capita to reach RM47,720 by 2020",2,1,1
Rebasing does not change GDP projection for 2019: DOSM,2,2,0
Malaysia's economy reaches new height of RM1.45 tln in 2018,2,1,1
Malaysia's economy reaches new height of RM1.45 trillion in 2018,2,1,1
rebasing does not change gdp projection for 2019: dosm,2,2,0
Malaysia's economy reaches new height of RM1.45 trillion in 2018,2,1,1
sabah eyes rm60b from manufacturing sector by 2030,2,2,1
The Sabah manufacturing sector is targeted at RM60b by 2030,2,2,1
Sabah Manufacturing Sector Targeted to Generate Rm60 Billion in Income,2,2,1
malaysia ends deflation streak in march,2,2,1
malaysian businesses can reach 179 mln active buyers on ebay,2,1,0
Escaping the Poverty-Nutrition Trap - Dr. Madeline Berma,2,0,1
Does Gdp Truly Reflect A Nation’s Progress?,2,1,1
Does Gdp Truly Reflect A Nation's Progress?,2,1,1
Federal Territory the pulse of nation's economy - Azmin,2,2,1
federal territory the pulse of nation’s economy: azmin,2,2,1
federal territory the pulse of nation’s economy – azmin,2,2,1
azmin: federal territories the pulse of nation's economy,2,2,1
Federal Territory the pulse of nation's economy - Azmin,2,2,1
Azmin: Federal Territories the pulse of nation's economy,2,2,1
azmin: federal territories the pulse of nation's economy,2,2,1
federal territory the pulse of nation’s economy – azmin ali,2,2,1
industrial chain upgrade for SMEs and large firms,2,2,1
let’s not forget the cha-cha-cha guan eng did with tommy thomas and richard malanjum,2,1,1
"Real estate, don't let the people squander",0,2,1
national+general,0,2,1
Local digital economy's growth slows in 2018,0,1,1
local digital economy’s growth slows in 2018,0,1,1
MATRADE steps up efforts to promote exports in the midst of a trade war,0,0,1
Matrade bolsters export promotion efforts amid trade war,0,0,1
Matrade bolsters export promotion efforts amid trade war,0,0,1
Creating 'bankable' housebuyers overnight is perilous,0,1,1
Controlling Rising Healthcare Costs Is Not A Magic Solution,0,0,0
when the main Muslim product is interpreted as a non-Muslim boycott,0,0,0
"women and business, separated no",0,0,0
"the week ahead: start of najib’s 1mdb trial, banks’ 2q results in focus",0,2,1
"40,000 unemployed graduates in Sabah",0,2,0
National+general,0,2,1
"the week ahead: eyes on us-china trade tensions, june ipi",0,0,1
The State of the Nation: Growth critical to cutting Malaysia's debt noose,0,0,0
FM: Our household debts are down. Start lending more please,0,1,1
"Household debt has gone down, banks need to expand access to loans - MalaysiaGazette",0,0,0
"Finance minister: Household debt down, banks please lend to new homebuyers",0,0,1
malaysia’s unemployment may reach 3.9 per cent in 2019,0,0,1
Don't sacrifice the performance of local universities with excessive backdoor quotas,0,2,0
The Week Ahead: Busy final week of corporate earnings announcements,0,2,1
Malaysia's IPI gains pace but 1Q GDP likely to weakened,0,0,1
my say: boosting the local economy through myth busting,0,1,0
"outwardly rich, inwardly poor",0,1,0
national+general,0,2,1
"business sentiment is weak, too important to ignore",0,0,0
"weak business sentiment, too big to ignore",0,0,0
"Ph regime's policies are not clear, unstable politics affect the country's economy",0,0,1
"headwinds abound for singapore, but economists say the silver lining lies in asean",0,0,1
Digitization of the country's economy benefits everyone,1,1,1
2019 marks year of SME empowerment,1,2,1
PropertyGuru anticipates glimmers of opportunity,1,1,1
malaysia's economy likely to grow in january–march 2020,1,2,1
Malaysia's economy is expected to grow in January-March 2020,1,2,1
Malaysia's economy is expected to grow next January-March,1,2,1
chief statistician: malaysia’s economy likely to grow in jan–march 2020,1,2,1
Malaysia's economy is expected to grow in January-March 2020,1,2,1
Malaysias economy likely to grow in January-March 2020,1,2,1
"minister: govt to provide rm20.7b in cash, incentives over five years for digitalisation",1,1,1
"Govt to provide RM20.7 billion in cash, incentives over 5 years for digitalisation",1,1,1
"Global players remain drawn to Malaysia's economy, strategic location - IQI chief economist | The Edge Markets",1,2,1
"global players remain drawn to malaysia’s economy, strategic location — iqi chief economist",1,2,1
"Global players remain drawn to Malaysias economy, strategic location - IQI chief economist",1,2,1
"the week ahead: eye on 3q gdp, singles’ day and trump impeachment inquiry",1,2,1
bank rakyat aims to achieve all the un sustainable development goals,1,2,1
Malaysia's digital economy contributes 18.5% to GDP in 2018,1,2,1
Rationalization of funding institutions to meet the requirements of SME participation - WKB2030,1,2,0
Shared Prosperity Vision is new national development narrative,1,1,1
midf research sees higher gdp growth in 2h19,1,1,1
MIDF Research sees higher GDP growth in 2H19,1,1,1
malaysia's gain companies poised for global impact,1,1,1
The Week Ahead: 1mdb’s First Ceo To Testify After Explosive Revelations,1,2,1
underqualified and overqualified fresh graduates,1,1,1
National+general,1,2,1
Thematic Property Investment: Education As A Catalyst.,1,2,1
100 mandatory facts to support Muslim and indigenous products,1,1,0
100 mandatory facts to support Muslim and indigenous products,1,1,0
100 arguments why you should support the #bmbf campaign,1,2,0
100 mandatory facts to support Muslim products & bumiputera products,1,1,0
My Say: The Unconventional Role Of Smes And Micro-enterprises For Economic Development,1,2,1
My Say: Gauging Consumer And Business Optimism,1,1,1
lazada ready for digital tax,1,1,1
Guan Eng: Malaysia's sustained economic growth continues to attracts FDI,1,1,1
Mof: Increase In Fitch Gdp Growth Projection Due To Steady Rise In Fdi,1,1,1
‘future gdp growth hinges on global devt’,1,1,1
MoF: Increase in Fitch GDP growth projection due to steady rise in FDI,1,1,1
Azmin: Malaysia Will Remain Vigilant Despite Stronger Growth In Q2,1,0,1
Would-be entrepreneurs urged to make use of SMEs Opportunities for B40 Group Programme,1,1,1
Azmin Pledges Vigilance Against Economic Headwinds,1,2,1
Malaysia will remain vigilant despite Q2 stronger growth -- Azmin,1,0,1
Azmin: Malaysia Will Remain Vigilant Despite Stronger Growth In Q2,1,0,1
azmin pledges vigilance against economic headwinds,1,2,1
"stop playing the blame game and admit the facts, ngo tells warisan",1,0,0
"Stop playing the blame game and admit the facts, NGO tells Warisan",1,0,0
Malaysia's economy seen to grow 4.5pc to RM1.51 trillion,1,2,1
"SME contribution to Malaysian GDP rises to 38.3%, valued at US$126.3b",1,1,1
"SME contribution to Malaysian GDP rises to 38.3%, valued at US$126.3b",1,1,1
sme contribution to gdp rises 38.3% to rm521.7bil,1,2,1
"sme contribution to malaysian gdp rises to 38.3%, valued at us$126.3b",1,1,1
sme contribution to gdp rises 38.3% to rm521.7bil,1,2,1
smes registered higher contribution to overall gdp,1,2,1
Smes’ Gdp Contribution Up 38.3pc To Rm521.7m,1,2,1
SME s' GDP contribution up 38.3 pct to RM521.7 mln,1,2,1
"MIER introduces new indicators of economic, cost of living growth",1,1,1
"mier introduces new indicators of economic, cost of living growth",1,1,1
Malaysia’s Economy Grew 5.5 Per Cent In 2018,1,2,1
"Malaysia's economy grew 5.5 Pct in 2018, GDP value at RM1.4tln",1,1,1
"Malaysia's Economy Grew 5.5% In 2018, Gdp Value At Rm1.4 Tril — Dosm",1,1,1
"Statistics Dept: Malaysia’s Economy Grew 5.5pc In 2018, Gdp Value At Rm1.4t",1,1,1
"Malaysia's economy grew 5.5 per cent in 2018, GDP value at RM1.4 trillion - DoSM",1,1,1
Industrial production expansion in May points to GDP growth,1,1,1
"malaysia's labour productivity grew 2.2pct in 2018, surpassing some developed nations",1,2,1
The Week Ahead: Trump-Xi meeting in Osaka set to dominate the news,1,0,1
Digitising to unlock growth potential,1,1,1
MOF: Decrease in Household Debt in 2018,1,0,1
"as economy recovers, putrajaya urges banks to make loans easier for homebuyers, smes",1,1,1
"As economy recovers, Putrajaya urges banks to make loans easier for homebuyers, SMEs",1,1,1
"The Week Ahead: Quiet on the local front, more excitement on the international scene",1,1,1
the country's e-commerce prospects are strong,1,1,1
Malaysia's economy grew 4.5% in first quarter of 2019,1,2,1
Malaysia's economy grows 4.5 pct in 1Q 2019,1,2,1
malaysia's economy grows 4.5pc in q1,1,2,1
malaysian economy grows 4.5pc in 2019 first quarter,1,2,1
bnm: malaysia 1q19 gdp grows 4.5% on agriculture rebound,1,2,1
malaysia’s economy grows 4.5 pct in 1q 2019,1,2,1
Banks intensifying focus on SMEs,1,2,1
"the week ahead: malaysia’s 1q2019 gdp, china’s industrial production and more trade barriers expected this week",1,2,1
Banks intensifying focus on SMEs,1,2,1
Sabah strives to increase revenue from manufacturing sector to RM60 bil by 2030,1,1,1
sabah strives to increase revenue from manufacturing sector to rm60b by 2030,1,1,1
Etrade Programme Help Smes Understand E-commerce,1,1,1
the state of the nation: china needs a bigger aspirin than rosier pmi data,1,2,1
Malaysian businesses can reach 179 million active buyers on eBay,1,1,0
Malaysian businesses can reach 179 million active buyers on eBay,1,1,0
Malaysian businesses can reach 179 million active buyers on eBay,1,1,0
Malaysian Businesses can reach 179m active buyers on eBay,1,1,0
Opportunity For SMEs To Learn eCommerce From the Experts,1,1,1
Advancing gender equality in Malaysia,1,2,1
NS economic growth is faster than Penang - Najib - MalaysiaGazette,1,1,1
acfa sets focus on growing malaysian smes’ participation in capital market,1,1,1
Break The Poverty Cycle With Better Food,1,0,0
report on 5g ready by 4q,1,0,1
the week ahead: eyes on january exports and bank negara’s opr decision,1,2,1
lge: no fear of deflation with 4.7% growth last year,1,0,1
"the week ahead: corporate earnings, saudi crown prince’s kl visit to take centre stage",1,2,1
"improved ipi support 2018 gdp growth between 4.8% and 4.9%, says ong",1,1,1
malaysia’s 2019 gdp set to grow at 4.9% — stanchart research,1,2,1
federal territories pulse of malaysia's development: azmin,1,2,1
"the week ahead: trade data, us fed and brexit in focus",1,2,1
Total Supply And Use In Malaysia Up 5.7% Per Year From 2010-2015,2,2,1
malaysia’s labour productivity increases 2.9% in q3,2,2,1
Labor Productivity Increased by 2.9 Percent in the Third Quarter of 2018,2,1,1
malaysia's q3 exports up 5.2pc,2,2,1
Malaysia's Exports Up 5.2% In Q3,2,2,1
"my say: increase wages, not retirement age",2,1,1
Analysts: Get Bumiputra To Fight In Open Economy,2,0,1
Great Malay Nation,2,1,1
"lead story: look at fundamentals, say analysts",2,2,0
rise of the app-trepreneurs,2,2,1
selangor maintains position as top gdp contributor in 2017,2,1,1
Selangor Stays As Main Economic Driver For Malaysia,2,2,1
The State Of The Nation: The Labour Conundrum,2,2,0
"One Month On, How Does Tabung Harapan's Collection Compare To Everything Else",2,2,1
The state government is reluctant to be asked to continue the 3p agenda,2,0,1
International Trade in Services Totaled Rm341.1b Last Year - Malaysiagazette,2,2,1
malaysia’s total trade of service up 8.6% in 2017,2,2,1
malaysia's total trade of service up 8.6% in 2017,2,2,1
malaysia's total international trade in services up 8% in 2017,2,2,1
Malaysia’s International Trade In Services Expanded Last Year,2,2,1
"My Say: Goodbye Gst, Hello Sst",2,2,1
"My Say: Goodbye Gst, Hello Sst",2,2,1
gst is now zero-rated ― here’s what you should know (video),2,2,1
Malaysia's Labour Productivity Up 3.0 Pct,2,2,1
Labor Productivity Increases Three Percent,2,2,0
Malaysian Labor Productivity Increased by Three Percent in the First Quarter of 2018,2,1,1
Cover Story: 5 Tasks For Ge14 Victors,2,2,1
The State Of The Nation: Living Wage A New Benchmark For Malaysia,2,2,1
the state of the nation: living wage a new benchmark for malaysia,2,2,1
the state of the nation: weightage changes cushioned january cpi,2,2,1
abdul karim leads delegation to nz,2,2,1
malaysia’s gdp expanded 5.9% in q4 2017,2,2,1
Edagang Will Reach 21,2,1,1
"miti eyes 10,000 e-commerce companies joining dftz",2,2,1
"Miti Targets 10,000 Companies Join Dftz",2,1,1
"miti eyes 10,000 e-commerce companies joining dftz",2,2,1
"miti eyes 10,000 e-commerce companies joining dftz",2,2,1
"miti eyes 10,000 e-commerce companies joining dftz",2,2,1
"Miti Eyes 10,000 E-commerce Companies Joining Dftz",2,2,1
"Hypermarket Sales Not The Only Benchmark Of Economy, Says Minister",2,2,0
september inflation seen rising to 0.9,0,2,1
frictions in global trade order – and what this spells for malaysia,0,2,1
Frictions In Global Trade Order – And What This Spells For Malaysia,0,2,1
concern over rising inequality in sabah,0,2,0
the week ahead: keeping an eye on mahathir’s china trip and july inflation,0,2,1
Sarawak Capable Of Hitting 2020 Gdp Target On Time,0,1,1
Sarawak Capable Of Hitting 2020 Gdp Target On Time,0,1,1
malaysia’s exports hit record high in april,0,2,1
Kelantan migration issue: Ikantan youth rebuke Azmin,0,2,1
"Local Smes Should 'up Their Game' With Latest Technologies, Says Sap",0,2,1
"Malaysia’s Digital Trade Booms As Nearly 60,000 Online Businesses Registered",0,2,1
Rahman Rebuts Mydin’s Claim Of Depleting Purchasing Power,0,2,1
Rahman Rebuts Mydin's Claim Of Depleting Purchasing Power,0,2,1
Rahman Rebuts Mydin's Claim Of Depleting Purchasing Power,0,2,1
The State Of The Nation: 'good' 1q Gdp Not Reflective Of Rest Of Year,1,2,0
Rbs: Weak Ringgit Not Giving Enough Push To Exports,1,0,0
Total Supply And Use In Malaysia Up 5.7% Per Year From 2010-2015,2,2,1
"selangor folk can pick ‘towel-clad’ mb, says azmin",2,2,1
women's empowerment data next week,2,2,1
the number of employees in the third quarter of 2017 increased - malaysiagazette,2,1,1
"economy on expansionary path, says dosm",2,2,1
"economy on expansionary path, says dosm",2,2,1
debate on nation's economy must be based on facts,2,2,0
of the cost of living and today's living expenses,2,2,1
keep retirees in workforce,2,2,0
