News_title,Sentiment(MaxEntropy),Sentiment(VADER),Sentiment(SparkNLP)
MSMEs call for moratorium to restart business,2,2,0
Rethinking tourism with travel tech | The Edge Markets,2,2,1
Why Are We Spending So Much Right Now,2,2,0
Why Are We Spending So Much Right Now,2,2,0
"Issue of film industry royalty to be reviewed, says PM",2,2,1
Issue of film practitioner royalty should be reviewed: PM,2,2,1
OPINION | Hilman's Blurry Understanding of Economics,2,0,0
"Selangor Journal: Selangor records over RM2.1 bln in revenue from Jan to Oct, surpassing target - MB",2,2,1
Selangor Surpasses Revenue Targets For 3rd Time Reaching RM2.1 Billion From Jan To Oct,2,1,0
"Selangor surpasses revenue target, records RM2. 065 bln",2,2,1
"ICT contributed 23.2% of GDP in 2021, DOSM reveals | The Edge Markets",2,2,1
NST Leader: Transport sector on budget?,2,2,1
Malaysians use credit cards more and borrow more | The Edge Markets,2,1,1
Digitalisation Imperatives for SMEs in Malaysia,2,2,1
Malaysians use credit cards more and borrow more,2,1,1
Stats Dept sees Malaysia's real GDP expanding 5.1pc in 2022,2,2,1
"Tourism industry generates RM197.9 bln GVATI in 2021, contributes 12.8 pct to GDP - DOSM",2,2,1
DOSM: Domestic Tourism Dominated With 97.4% To Tourism Expenditure In 2021,2,2,1
"Seeking balanced development for Sabah, Sarawak By Mohammad Zulhafiy Zol Bahari",2,2,0
Budget 2023 wishlist : SMEs call for more automation and digitalisation grants,2,1,1
Budget 2023 wishlist : SMEs call for more automation and digitalisation grants,2,1,1
Sabah and Sarawak: The journey to a more inclusive Malaysia (Part 2) By Amanda Yeo,2,2,1
Sabah and Sarawak: The journey to a more inclusive Malaysia (Part 2),2,2,1
There are more men in Melaka,2,2,1
The people of Melaka are more male,2,2,1
PARTNER IN MSMEs' DIGITAL JOURNEY,2,2,1
PARTNER IN MSMEs' DIGITAL JOURNEY,2,2,1
Malaysia's labour productivity up 5.5% in Q2 2022 - DOSM | The Edge Markets,2,2,1
Malaysia's labour productivity 5.5 pct up in Q2 2022 - DoSM,2,2,1
"Sarawak plans to increase the area of ​​state assembly, parliament",2,1,1
More rate hikes ahead after GDP's surprise upside in 2Q,2,1,1
Core inflation is projected at upper range,2,2,0
More rate hikes ahead after GDP's surprise upside in Q2,2,1,1
Ringgit ends higher against US dollar for fourth consecutive day,2,2,1
Ringgit ends higher against US dollar for fourth consecutive day,2,2,1
Core inflation forecast at upper range of 2% to 3% in 2022,2,2,0
BNM: Core inflation forecast at upper range of 2-3 pct in 2022,2,2,1
Core inflation forecast at upper range of 2% to 3% in 2022,2,2,0
Malaysia has fiscal space to manage price pressures,2,0,1
Tengku Zafrul: Malaysia's inflation may reach 'around 11%' in subsidies' absence | The Edge Markets,2,1,1
SME's GDP 1.0 pct up in 2021 but slower than Malaysia's 3.1 pct -- DoSM,2,2,1
Compensation Of Employees Contributed 34.8% Of The Nominal GDP,2,2,1
"Compensation of employees contributes 34.8 pct to the nominal GDP, says DoSM",2,2,1
GFCF Declined Marginally to RM278.7b in 2021 - DOSM,2,2,0
GFCF declined marginally to RM278.7b in 2021 - DOSM | The Edge Markets,2,2,1
Gross Fixed Capital Formation In 2021 Declines Marginally TO RM278.7 Billion In 2021-DOSM,2,0,0
Stats Dept: Malaysia's Gross Fixed Capital Formation declines marginally to RM278.7b in 2021,2,0,0
GFCF declines marginally to RM278. 7bil in 2021,2,2,0
GFCF declines marginally to RM278.7 bln in 2021 -- DoSM,2,2,0
GFCF recorded RM278.7b in 2021,2,2,1
Private household size in Kelantan the highest in Malaysia: DOSM,2,2,1
Private household size in Kelantan the highest in Malaysia - DOSM,2,2,1
"Kelantan's average household size is 4.9 people, the highest in Malaysia: DOSM",2,2,0
"Kelantan's average household size is 4.9 people, the highest in Malaysia - DoSM",2,2,0
"The average household size in Kelantan is 4.9 people, the highest in Malaysia",2,2,1
"Kelantan has largest private household size in Malaysia, says Statistics Dept",2,2,1
"Malaysia should continue to revitalise economy, increase competitiveness",2,1,1
"Malaysia should continue to revitalise economy, increase competitiveness -- IMD",2,1,1
MIDF Research: Malaysia's retail trade sales set to expand by +10.5pc,2,1,1
Pushing batik production creates jobs,2,1,1
"Malaysia Digital shows country's readiness to be at forefront of digital economy, says Annuar",2,1,1
The halal industry has a place in society,2,2,0
The national economy is expected to increase this year,2,1,1
Malaysia's sports industry contributed RM18.8b in 2017 - that's just the tip of the iceberg,2,2,1
Malaysia experiences boom in non-exec labour market post-pandemic,2,2,1
Govt to foster agriculture sector to expedite structural transformation,2,2,1
'Holistic approach needed for structural reforms',2,2,1
"Holistic approach needed for structural reforms, GST reinstatement: Economists",2,2,0
"Holistic approach needed for structural reforms, GST reinstatement - Economists",2,2,0
"Holistic approach needed for reinstatement of GST, structural reforms, Putrajaya told",2,2,0
"Holistic approach needed for structural reforms, GST reinstatement - Economists",2,2,0
"GST level of long-term economic resilience, ringgit",2,2,1
"Holistic approach needed for structural reforms, GST reinstatement - Economists",2,2,0
"Holistic approach needed for structural reforms, GST reinstatement: Economists",2,2,0
Malaysia's economy expected to expand further after favourable performance in 1Q22 - DOSM,2,1,1
Malaysia's economy expected to expand further after favourable performance in Q1 2022: DOSM,2,1,1
Malaysia's economy expected to expand further after favourable performance in Q1 2022 -- DoSM,2,1,1
Malaysia's economy is expected to expand further after favourable performance in Q1 2022,2,1,1
Malaysia's economy expected to expand further after favourable performance in first quarter 2022,2,1,1
DOSM: Malaysia's economy expected to expand further after favourable performance in Q1 2022,2,1,1
Stats Dept: Malaysia's economy expected to expand further after favourable performance in Q1 2022,2,1,1
"SMA, LSD to create big data for state's land",2,1,1
Let's move Sarawak's digital economy together,2,2,1
"Premier: SMA, Land and Survey building big data for land in Sarawak",2,2,1
Sarawak Premier calls on Sarawakians to mobilise digital economy,2,2,1
Sarawak Premier calls on Sarawakians to mobilise digital economy,2,2,1
The people must move the digital economy together - Premier Sarawak,2,2,1
Reasons Seven Days Paternity Leave Is Not Enough,2,0,0
Reasons why seven days paternity leave is not enough,2,0,0
Reasons why seven days paternity leave is not enough,2,0,0
DOSM launches OpenDOSM as alternative to open data access,2,2,1
RHB Research sees Tasco on track for record-breaking year,2,2,1
Malaysia Targets RM77 Billion Revenue From International Tourists By 2025,2,2,1
MDEC eyes over RM1t e-commerce income again,2,2,0
"Malaysia's e-commerce income can breach RM1 tril again this year, says MDEC",2,2,0
Malaysia's e-commerce income can breach RM1 trillion again this year - MDEC,2,2,1
Malaysia's e-commerce income can breach RM1 trillion again this year - MDEC,2,2,1
MDEC: Malaysia's e-commerce income can breach RM1t again this year,2,2,1
Is Malaysia entering a high inflation cycle,2,2,1
Covid-19 affects household income in Sarawak,2,2,0
Socso forsees job markets returning to pre-COVID levels soon,2,2,1
Socso expects job market to return to pre-pandemic level,2,2,0
Socso expects job market to return to pre-pandemic level soon,2,2,1
The need for fiscal reforms supersedes oil price windfall - Economists,2,2,0
Socso expects job market to return to pre-pandemic level,2,2,0
Political and economic stability must,2,2,1
Creating an environment to drive Malaysia's business forward By Amien Jamaluddin,2,1,1
What Johoreans need are economic and political stability,2,2,0
Government Launches SemarakNiaga An RM40 Billion Business Financing Program,2,2,1
"Govt Allocating RM4.8 Billion To Create 600,000 Jobs",2,1,0
Government maintains GDP projection of 5.5 percent to 6.5 percent for 2022 - Tengku Zafrul,2,2,1
Government maintains GDP projection of 5.5 percent to 6.5 percent for 2022 - Tengku Zafrul,2,2,1
'2021 economy smaller than PH's last year',2,2,1
"GDP in 2021 recorded 3.1%, the government's measures yielded results",2,2,1
"""The Malaysian Employers Federation is full of baloney!""",2,2,0
Govt taking bold decisions to put economy back in growth trajectory -- Juwai IQI,2,1,1
Fast Track Your Career In Accountancy With AAT,2,2,1
Minister: Census shows Malaysia's oldest man and woman aged 120 and 118; preliminary census findings to be released in Feb 2022,2,2,1
Minister: Census shows Malaysia's oldest man and woman aged 120 and 118; preliminary census findings to be released in Feb 2022,2,2,1
Minister: Census shows Malaysia's oldest man and woman aged 120 and 118; preliminary census findings to be released in Feb 2022,2,2,1
"E-commerce, food delivery services GMV expand by US$7 bln in 2021",2,1,1
"E-commerce, food delivery services GMV expand by US$7b in 2021 - Mustapa",2,1,1
"E-commerce, food delivery services GMV expand by US$7 bln in 2021 - Mustapa",2,1,1
Retail trade to expand 5.5% this year: MIDF Research,2,1,1
"Retail trade to expand 5.5% in 2022, says MIDF Research",2,1,1
Retail trade to expand 5.5 pct in 2022 - MIDF Research,2,1,1
Malaysia's GDP Expected To Expand By Up To 6.0 Pct In 2022,2,1,1
Kenanga expects Malaysia's GDP to expand by up to 6.0 pct in 2022,2,1,1
Most industries not ready for minimum wage hike,2,0,0
Political stability helps strengthen short & long term flood governance,0,1,1
"Weaker ringgit can boost tourism, says Malaysian Employers Federation",0,0,1
The number of unemployed in Malaysia is decreasing,0,1,0
OPR review curbs inflationary pressures,0,0,1
MTUC urges the full implementation of the 1955 Work Act starting September 1,0,2,1
"Malaysia's unemployment rate down to 3.8% in June, lowest since Covid-19 pandemic struck | The Edge Markets",0,0,0
CPI alone may not be the best inflation gauge for Malaysia,0,0,1
Malaysia's gross fixed capital formation recorded RM278.7 billion,0,0,1
Malaysia's Gross Fixed Capital Formation to hit RM278.7 billion in 2021 - Statistics,0,0,0
"Stories That Caught Our Attention; Global Credit Outlook More Negative This Year, US Economy Dwindled Worse-Than Expected 1.6% Last Quarter As Recession Fears Heighten And Malaysian Producer Price Index Record High In May",0,0,1
"After the subsidy was abolished, the M40 group and SMEs did not get any help",0,0,0
Food Insecurity: Where we went wrong (Part 1),0,0,0
The urgent case for climate crisis mitigation in the National Recovery Plan,0,0,0
Shift in consumer purchasing behaviour as inflation hits,0,2,0
Consumer purchasing behavior is declining following inflation,0,2,1
Consumer purchasing behavior is declining following inflation,0,2,1
Shift in consumer purchasing behaviour as inflation hits,0,2,0
Consumer purchasing behavior is declining following inflation,0,2,1
Shift in consumer purchasing behaviour as inflation hits,0,2,0
Consumer purchasing behavior is declining following inflation,0,2,1
"From ringgit crash to bond rout . What's next, Mr Finance Minister",0,0,1
"Higher minimum wage worsens unemployment, inflation? Not necessarily.",0,0,0
"Minimum wage causes unemployment, high inflation? Not necessarily",0,0,0
Evidence PM Failed to Restore Economy,0,0,0
"The country's economy is projected to be good, the PM denies failing to restore the economy",0,0,1
"National Economy On Good Projection, PM Denies Failing To Restore Economy",0,0,0
"The country's economy is projected to be good, the PM denies failing to restore the economy",0,0,1
"The country's economy is projected to be good, the PM denies failing to restore the economy",0,0,1
"The country's economy is projected to be good, the PM denies failing to restore the economy",0,0,1
"The national economy is projected to be good, PN denies failing to restore the economy",0,0,0
"Country's Poverty Rate Has Decreased Significantly, Parliament",0,0,1
Fresh graduates worst hit as minimum wage debate continues,0,0,0
The State of the Nation: Malaysia's continuous struggle with foreign labour,0,0,0
The State of the Nation: Malaysia's continuous struggle with foreign labour,0,0,0
"Malaysia's jobless rate in 4Q21 fell to lowest since Covid-19, says DOSM",0,0,0
"Malaysia's jobless rate in 4Q21 fell to lowest since Covid-19, says DOSM",0,0,0
Nusantara: Boon or bane for Malaysia,0,2,1
RM6.1 bil loss for country after nationwide floods: DOSM,0,0,1
Malaysia incurs loss of RM6.1 billion following nationwide floods,0,0,0
Malaysia incurs loss of RM6.1 bln following nationwide floods - DOSM,0,0,0
"Dec 2021 floods cost RM6.1 billion in losses, Statistics Dept says",0,0,0
Malaysia incurs loss of RM6.1b following nationwide floods - DOSM,0,0,0
"Govt considering aid in the form of special grants for MSMEs, informal traders affected by flood",0,1,1
"Govt considering aid in the form of special grants for micro SMEs, informal traders affected by flood",0,1,1
Govt considering aid in the form of special grants for MSMEs affected by flood,0,1,1
"Govt considering aid in the form of special grants for MSMEs, informal traders affected by flood",0,1,1
KDEBWM: Elevating Malaysia's Waste Management Landscape To A Global Standard,0,0,1
Eradicating child poverty top priority,0,0,0
Flood Involves Losses of RM5.3 to 6.5 billion,0,0,0
"Tok Pa: E-commerce, food delivery service gross merchandise value expanded nearly RM30b in 2021",0,0,1
"Tok Pa: E-commerce, food delivery service gross merchandise value expanded nearly RM30b in 2021",0,0,1
Underemployment remains a concern amid lowest unemployment rate,0,0,0
Malaysia's economy seen remaining steady going forward but analysts warn of potential headwinds,1,0,1
Malaysia's economy seen remaining steady going forward but analysts warn of potential headwinds,1,0,1
Malaysia's economy seen remaining steady going forward but analysts warn of potential headwinds,1,0,1
DoSM: Malaysia's 3Q GDP grows 14.2,1,2,1
"BNM may front-load more OPR hikes in 2023 to tackle core inflation, say economists",1,2,0
Economic Stability In Near Term Supported By Convincing Domestic Demand And Robust External Sector - DOSM,1,1,1
GE15: Health And Care Priorities For The New Government - Galen Centre,1,1,1
Altair Believes Budget 2023 Has A Key Role In Boosting Digital Adoption Among MSMEs,1,1,1
Malaysia's real GDP to grow 5.1% in 2022,1,2,1
Malaysia's real GDP to grow 5.1 pct in 2022 - DoSM,1,2,1
Malaysia's real GDP to grow 5.1 per cent in 2022 - DOSM,1,2,1
Malaysia's real GDP expected to see 5.1% growth,1,1,1
"Tourism industry generates RM197. 9bil GVATI in 2021, contributes 12.8% to GDP",1,2,1
"Seeking balanced development for Sabah, Sarawak",1,2,0
Signs of Sabah economy recovering,1,2,1
"Gross Domestic Product up by more than 1pc, showing signs of recovery: Drop in Sabah's population growth",1,0,0
"Sabah's economy saw gradual recovery, says Hajiji",1,2,0
"Census stats can help Sabah improve development plans, says Hajiji",1,1,1
"Sabah GDP up by more than 1 pct, economy recovering",1,2,1
Sabah's economy recovering gradually - CM,1,2,1
DOSM: Economic indicators point to continuous growth,1,1,1
DoSM: Economic indicators point to continuous growth,1,1,1
Guan Eng throws doubt on Malaysia's '8.9pc economic growth',1,1,0
"Guan Eng throws doubt on Malaysia's '8.9pc economic growth', asks if due to one-off EPF withdrawals worth RM44b",1,0,1
"Guan Eng throws doubt on Malaysia's '8.9pc economic growth', asks if due to one-off EPF withdrawals worth RM44b",1,0,1
'Very clear Malaysia no longer in crisis': BNM governor,1,1,1
"Very clear Malaysia no longer in crisis, says BNM governor",1,0,1
'Very clear Malaysia no longer in crisis' -- BNM Governor,1,0,1
"Tengku Zafrul: Malaysia able to manage price pressures, still room in fiscal space",1,0,1
"Malaysia able to manage price pressures, still room in fiscal space: Tengku Zafrul",1,0,1
"Tengku Zafrul: Malaysia able to manage price pressures, still room in fiscal space",1,0,1
"Malaysia able to manage price pressures, still room in fiscal space -- Tengku Zafrul",1,0,1
"GDP Stands At 1.39 Trillion For 2021, With States Recording Average Growth Of 3.1%: DOSM",1,1,1
Convincing economic recovery outlook,1,1,1
CM sees positive economic outlook for Sabah as tourist arrivals rise by 442 per cent,1,1,1
Zafrul: No risks of a recession,1,0,0
Zafrul: No risks of a recession,1,0,0
Encouraging GDP Growth Will Strengthen Economy In Q2,1,1,1
Malaysia's 2022 GDP could grow 5.7 pct despite IMF's downgrade,1,2,1
Malaysia's 2022 GDP could grow 5.7 pct despite IMF's global growth downgrade,1,0,1
Sustainable Investment Strategies for SMEs,1,2,1
Analysts expect GDP growth to wane in the next six months,1,1,1
Communications minister: Malaysia Digital initiative shows country's readiness to be at forefront of digital economy,1,1,1
Penang expects further GDP growth in 2022 after last year's record high,1,1,1
"All states record positive growth, 5 states outperform national growth rate, says chief statistician",1,1,1
Penang expects further GDP growth in 2022 after last year's record high,1,1,1
"All states record positive growth, five outperform national growth rate - DOSM",1,1,1
"All states record positive growth, 5 states outperform national growth rate: Chief statistician",1,1,1
"All states record positive growth, 5 states outperform national growth rate: Chief statistician",1,1,1
"Priority for food security, Penang govt urged",1,1,1
"Give priority to food security, Penang govt urged",1,1,1
"Give priority to food security, Penang govt urged",1,1,1
Malaysia's economy to continue recovery momentum this year - Tengku Zafrul,1,2,1
"Malaysia's economy to continue recovery momentum this year, says",1,2,1
"Malaysia's economy to continue recovery momentum this year, says",1,2,1
Tengku Zafrul: Malaysia's economy to continue recovery momentum this year,1,2,1
Malaysia's economy to continue recovery momentum this year - Tengku Zafrul,1,2,1
Malaysia's economy to continue recovery momentum this year - Tengku Zafrul,1,2,1
Malaysia's economy to continue recovery momentum this year: Tengku Zafrul,1,2,1
Malaysia's economy grew 5% in 1Q22 from a year earlier,1,2,1
"Minimum wage: Onus on govt to support struggling SMEs, rights groups say",1,0,1
"The floor wage debate: Onus on govt to support struggling SMEs, rights groups say as data shows small businesses grew by over 5pc annually since 2013",1,0,1
"The floor wage debate: Onus on govt to support struggling SMEs, rights groups say as data shows small businesses grew by over 5pc annually since 2013",1,0,1
E-wallet usage increased by 131% in 2020,1,1,1
e-wallet usage increased by 131% in 2020,1,1,1
e-wallet usage increased by 131 pct in 2020,1,1,1
Minister: E-wallet usage in Malaysia increased by 131pc in 2020,1,1,1
E-wallet usage increased by 131 pct in 2020,1,1,1
Slower economic growth expected for Malaysia,1,1,1
"Malaysia on track to achieve 2022 economic targets, says PM Ismail Sabri",1,2,1
"Malaysia on track to achieve 2022 economic targets, says PM Ismail Sabri",1,2,1
Malaysia on track to achieve 2022 economic targets: PM,1,2,1
"Malaysia on track to achieve 2022 economic targets, says PM Ismail Sabri",1,2,1
"Malaysia on track to achieve 2022 economic targets, says PM Ismail Sabri",1,2,1
DOSM optimistic Malaysia's economy will continue to recover in 2022,1,1,1
Brighter outlook for Malaysia's property market but headwinds remain,1,1,1
DOSM optimistic Malaysia's economy will continue to recover in 2022,1,1,1
Stats Dept optimistic Malaysia's economy will continue to recover in 2022,1,1,1
DoSM optimistic Malaysia's economy will continue to recover in 2022,1,1,1
Stats Dept optimistic Malaysia's economy will continue to recover in 2022,1,1,1
DOSM optimistic Malaysia's economy will continue to recover in 2022,1,1,1
"Malaysia on good track to achieve its economic projection targets, says Ismail Sabri",1,1,1
Malaysia on good track to achieve its economic projection targets,1,1,1
Malaysia on good track to achieve its economic projection targets -- Ismail Sabri,1,1,1
"The need for economic, political stability",1,2,1
Govt to focus on lowering jobless rate by providing more employment opportunities - Tengku Zafrul,1,1,0
Tengku Zafrul: Govt to focus on lowering jobless rate by providing more employment opportunities,1,1,0
Govt to focus on lowering jobless rate by providing more employment opportunities - Tengku Zafrul,1,1,0
"Govt maintains 5.5-6.5pc GDP growth forecast for 2022, says Tengku Zafrul",1,1,1
"M'sian economy to grow 5.5% to 6.5% this year, Tengku Zafrul projects",1,2,1
"Govt maintains 5.5-6.5pc GDP growth forecast for 2022, says Tengku Zafrul",1,1,1
Govt maintains 5.5-6.5 pct GDP growth forecast for 2022: Tengku Zafrul,1,1,1
Govt maintains 5.5-6.5 pct GDP growth forecast for 2022,1,1,1
"Govt maintains 5.5-6.5pc GDP growth forecast for 2022, says Tengku Zafrul",1,1,1
Tengku Zafrul: Govt maintains 5.5-6.5% GDP growth forecast for 2022,1,1,1
Govt maintains 5.5-6.5% GDP growth forecast for 2022,1,1,1
Govt maintains 5.5-6.5 pct GDP growth forecast for 2022 - Tengku Zafrul,1,1,1
Bursa Malaysia likely to continue uptrend next week on improved sentiment,1,1,1
Bursa Malaysia expected to continue uptrend next week on improved sentiment,1,1,1
Govt maintains 5.5-6.5% GDP growth forecast for 2022 - Tengku Zafrul,1,1,1
FBM KLCI higher at midday on improved 4Q GDP result,1,0,1
MIDF Research expects Malaysia's IPI to grow 4.3% in 2022,1,2,1
MIDF Research expects Malaysia's IPI to grow 4.3 pct in 2022,1,2,1
MIDF Research expects Malaysia's industrial production index to grow 4.3pc in 2022,1,2,1
A new era of international economic cooperation,1,2,1
New light for job seekers,2,2,0
Weekly Economic Analysis by MANOKARAN MOTTAIN,2,2,1
100-day Aspirasi Keluarga Malaysia - a case of letting the fox guard the henhouse,2,2,1
Malaysia needs to revisit agri sector,2,2,1
"Stats Dept: Malaysia needs to revisit agriculture sector, invest in modernisation",2,2,1
"Stats Dept: Malaysia needs to revisit agriculture sector, invest in modernisation",2,2,1
"Malaysia needs to revisit agriculture sector, invest in modernisation - DOSM",2,2,1
More young agropreneurs needed as agriculture industry evolves,2,2,0
More young agropreneurs needed as agriculture industry evolves,2,2,0
Budget 2022: A colour-blind budget for all in Keluarga Malaysia,2,2,0
A colour-blind budget for all in Keluarga Malaysia,2,2,0
Budget 2022: A colour-blind budget for all in Keluarga Malaysia,2,2,0
Budget 2022: A colour-blind budget for all in Keluarga Malaysia,2,2,0
MALAYSIAN ECONOMY INCREASED 3.0,2,1,1
A colour-blind Budget 2022,2,2,0
Melaka's GDP contracted by 5.9 percent due to COVID-19,2,2,1
"5G to push Malaysia's GDP by RM122bil, says Ernst & Young",2,2,1
"5G to push Malaysia's GDP by RM122bil, says Ernst & Young",2,2,1
"5G to push Malaysia's GDP by RM122bil, says Ernst & Young",2,2,1
Budget 2022: Summary For Sabah Traders & Entrepreneurs,2,2,1
Budget 2022: What's On The Experts Wishlist,2,2,0
"The Week Ahead: Budget 2022, G20 summit, Japan's election in focus",2,2,1
Post-Covid growth - address barriers to business digital transformation,2,1,1
'12MP should promote new forms of employment',2,1,2
Mid-tier companies' funding needs increasingly in focus,2,2,0
Extend social security to those self-employed,2,1,1
State DAP starts petition for state govt to include all SMEs in BKSS 7.0,2,2,1
Maybank targets a surge in SME participation in the digital platform through Maybank2u Biz,2,2,1
"The Week Ahead: 12MP, August trade data and final iteration of US 2Q GDP in focus",2,2,1
Tourism receipts fell 71.2 percent to RM52.4 billion last year - Chief Statistician,2,2,0
Malaysia's Tourism Receipts Plunge 71.2 Percent To 12.51 Billion USD,2,2,1
"All over for SMEs if economy doesn't open fully by October, says Guan Eng",2,2,1
"All over for SMEs if economy doesn't open fully by October, says Guan Eng",2,2,1
6 key takeaways from the economy in Q2,2,2,1
"All over for SMEs if economy doesn't open fully by October, says Guan Eng",2,2,1
RM200m allocation for Bumiputera Supply Chain Financing Programme,2,2,1
Ringgit extends gains to end higher against US dollar,2,1,1
Ringgit extends gains to end higher against US dollar,2,1,1
MATRADE organizes cross-border online trading meetings,2,2,1
MATRADE hosts cross-border online trade meetings in Bangkok to boost e-commerce,2,1,1
MATRADE organizes a cross-border online trade meeting for the e-commerce floor,2,2,1
Fitch Solutions predicts 0% GDP growth for 2021,2,1,1
Stats Dept: Govt's final consumption expenditure expands 9pc in Q2,2,1,1
Stats Dept: Govt’s final consumption expenditure expands 9pc in Q2,2,1,1
Stats Dept: Govt's final consumption expenditure expands 9pc in Q2,2,1,1
Govt's final consumption expenditure expands 9.0 pct in Q2,2,1,1
Fate of main businesses in the tourism industry still hangs in balance By YS Chan,2,2,1
Fate of main businesses in the tourism industry still hangs in balance,2,2,1
Average income is expected to increase this year - Department of Statistics,2,1,1
All states face challenges in dealing with the impact of Covid-19: DOSM,2,1,0
Stats Dept: Eight states' GDP shrunk at a smaller rate compared to Malaysia's last year amid pandemic,2,2,0
Stats Dept: Eight states' GDP shrunk at a smaller rate compared to Malaysia's last year amid pandemic,2,2,0
Stats Dept: Eight states' GDP shrunk at a smaller rate compared to Malaysia amid Covid-19 last year,2,2,1
Stats Dept: Eight states’ GDP shrunk at a smaller rate compared to Malaysia amid Covid-19 last year,2,2,1
