News_title,Sentiment(MaxEntropy),Sentiment(VADER),Sentiment(SparkNLP)
Self Employed Need Better Social Protection Measures,1,1,0
"Govt should focus on SME cash flow in budget 2022, says SME Malaysia",1,2,1
"Govt should focus on SME cash flow in Budget 2022, says SME Malaysia",1,2,1
SMEs request cash flow support in the 2022 Budget,1,1,1
"Creative industry contributed RM29.4b to GDP in 2019, says deputy minister",1,1,1
Creative industry contributed RM29.4 bln to GDP in 2019,1,1,1
"Creative industry contributed RM29.4b to GDP in 2019, says deputy minister",1,1,1
Creative industry contributed RM29.4 bln to GDP in 2019,1,1,1
Expand FDI scope to drive recovery,1,1,1
Economists: 12MP should focus on digital economy,1,2,0
Need for govt to focus on digitalisation,1,2,0
"Digital economy key to making M'sia a high-income nation, experts say",1,2,1
Economists: 12MP should focus on digital economy to achieve high-income nation status,1,2,1
12MP should focus on digital economy to achieve high-income nation status,1,2,1
Economists:12MP should focus on digital economy to achieve high-income nation status,1,2,1
RMK-12: The digital economy is the main focus of achieving a high-income economy in 2024,1,2,1
RMK-12: The digital economy is the main focus of achieving a high-income economy in 2024,1,2,1
Economists: 12MP should focus on digital economy to achieve high-income nation status,1,2,1
Economists: 12MP should focus on digital economy to achieve high-income nation status,1,2,1
12MP should focus on digital economy to achieve high-income nation status - economists,1,2,0
RMK-12: The digital economy is the main focus of achieving a high-income economy in 2024,1,2,1
12MP should focus on digital economy to achieve high-income nation status: Economists,1,2,0
12MP should focus on digital economy to achieve high-income nation status -- Economists,1,2,0
Malaysia's August consumer price index still on downward path as pandemic drags on,1,0,0
"12MP should focus on digital economy, experts say",1,2,0
12MP should focus on digital economy to achieve high-income nation status,1,2,1
"SME Bank launches BEP, creating bumiputera exporters",1,1,1
"Stop repeating empty slogans, help small business owners survive, Gov't told",1,0,0
"Stop repeating empty slogans, help small business owners survive, Gov't told",1,0,0
Corruption is inhibiting a healthy SME environment,1,1,1
Corruption is inhibiting a healthy SME environment,1,1,1
Stats Dept: Foreign-controlled firms contributed RM241b to Malaysia's GDP in 2020,1,2,1
Stats Dept: Foreign-controlled firms contributed RM241b to Malaysia's GDP in 2020 | Money,1,2,1
Stats Dept: Foreign-controlled firms contributed RM241b to Malaysia's GDP in 2020,1,2,1
Stats Dept: Foreign-controlled firms contributed RM241b to Malaysia's GDP in 2020,1,2,1
"The economy is expected to be stronger, the unemployment rate decreased from last month",1,0,1
"'The economy is expected to be stronger, the unemployment rate will decrease from this month'",1,0,1
"The economy is expected to be stronger, the unemployment rate will decrease from Sept 2021",1,0,1
"The economy is expected to be stronger, the unemployment rate will decrease from Sept 2021 - Mustapa",1,0,1
"Stronger Economy, Lower Unemployment Rate",1,0,0
'Invest to strengthen healthcare system',1,1,1
"Reopening the economy fully by October crucial to save SMEs, lives and liveliood",1,1,1
My Say: Striving for societal well-being,1,2,1
"Niaga AWANI: National Day 2021 | Economic recovery, structural changes and RMK-12",1,2,1
Sabah must ramp up the vaccinations,1,2,0
July inflation eases to five-month low amid lockdown and cautious consumer spending,1,0,0
Ramp up vaccination for Sabah,1,2,0
Fitch Unit Cuts Malaysia's GDP Growth Forecast To Zero From 4.9% - Ringgit Falls To One-Year Low,1,0,0
National Recovery On Right Trajectory,1,2,1
DoSM: Malaysia’s economy grew 16pc in Q2 following initial dip in 2020,1,2,1
DoSM: Malaysia's economy grew 16pc in Q2 following initial dip in 2020,1,2,1
DoSM: Malaysia's economy grew 16pc in Q2 following initial dip in 2020,1,2,1
E-commerce continues to grow,1,2,1
"2Q21 GDP seen to grow double-digit y-o-y, but q-o-q contraction likely",1,2,1
Tackle rising youth unemployment,1,0,1
Fate of main businesses in the tourism industry still hangs in balance By YS Chan,1,2,1
Tackle rising youth unemployment,1,0,1
Per capita income to rise this year:DOSM,1,2,1
Per capita income to increase this year - DOSM,1,1,1
DOSM: Per capita income to increase this year,1,1,1
Per capita income to increase this year - DOSM,1,1,1
DOSM: Per capita income to increase this year,1,1,1
Need to help PKS continue to survive,1,1,0
Need to help PKS continue to survive,1,1,0
Graduates flexible despite underemployment,1,1,1
The contribution of SMEs to GDP contracted by 7.3 percent in 2020,1,2,1
The contribution of SMEs to GDP contracted by 7.3 percent in 2020,1,2,1
Statistics Dept: SMEs' contribution to Malaysia's GDP down by 7.3pc last year,1,2,1
SMEs' contribution to GDP down by 7.3 pct in 2020 - DOSM,1,2,1
SMEs' contribution to GDP down by 7.3 pct in 2020 - DOSM,1,2,1
Stats Dept: SMEs' contribution to GDP down by 7.3pc in 2020,1,2,1
Business gross opearting surplus decreased by 6.9 pct in 2020 - DOSM,1,0,1
Business gross opearting surplus decreased by 6.9 pct in 2020 - DOSM,1,0,1
Business gross opearting surplus decreased by 6.9 pct in 2020 - DOSM,1,0,1
Business gross operating surplus decreased by 6.9% in 2020 - DOSM,1,0,1
Business gross operating surplus decreased by 6.9 pct in 2020 - DoSM,1,0,1
Statistics Dept: Malaysia’s gross fixed capital formation shrunk 14.5pc to RM281.1b in 2020,1,0,2
Statistics Dept: Malaysia’s gross fixed capital formation shrunk 14.5pc to RM281.1b in 2020,1,0,2
DOSM: Malaysia’s Gross Fixed Capital Formation contracts 14.5 pct to RM281.1 bln in 2020,1,0,1
Statistics Dept: Malaysia’s gross fixed capital formation shrunk 14.5pc to RM281.1b in 2020,1,0,2
"Concerned about the plight of SMEs when the pandemic hits, various assistance is available to ensure the survival of the industry",1,1,1
RM100m govt aid for FCLO too little,1,2,0
"'New cabinet appointments won’t rock the boat, as long as people’s health, economy under control'",1,2,1
"New cabinet appointments won’t rock the boat, as long as people’s health, economy under control",1,2,1
"New cabinet appointments won’t rock the boat, as long as people’s health, economy under control",1,2,1
"New cabinet appointments won’t rock the boat, as long as people’s health, economy under control",1,2,1
"New cabinet appointments won’t rock the boat, as long as people’s health, economy under control",1,2,1
"New cabinet appointments won't rock the boat, as long as people's health, economy under control",1,2,1
CAP: Here's how the government can do more to prevent suicide,1,0,0
The government needs to include measures to prevent suicide in the MCO plan,1,0,0
CAP: Incorporate suicide prevention in MCO plans,1,0,1
The government needs to include measures to prevent suicide in the MCO plan,1,0,0
BOMBSHELL – THE MONEY BEHIND MUHYIDDIN’S HALF-BAKED MCOs REVEALED – ALL HE NEEDED TO DO WAS SPEND RM50 BIL TO KEEP PEOPLE HOME FOR 3 MONTHS – BUT HE CAME OUT WITH FLIP-FLOP LOCKDOWNS INSTEAD & ENDED UP SPENDING RM800 BIL ON DUBIOUS STIMULUS PACKAGES – WHILE THE ORDINARY PEOPLE GO HUNGRY FOR THE FIRST TIME IN MALAYSIA’S HISTORY & MANY EVEN RESORT TO KILLING THEMSELVES,1,0,0
Re-examine the 2021 GDP projections,1,2,1
Please continue to aid the rakyat with more packages,1,1,1
"Keep helping the rakyat, think tank tells Gov’t",1,1,0
"GDP projections will be revised, the Department of Statistics said",1,2,1
Stats Dept: Eight states record better growth performance in 2020,1,1,1
2021 GDP projections to be revised: Department of Statistics,1,2,1
Eight states with better growth track record: Statistics,1,1,1
The 2021 GDP projection will be reviewed - Department of Statistics,1,2,0
Stats Dept: Eight states record better growth performance in 2020,1,1,1
2021 GDP projections to be revised: Department of Statistics,1,2,1
2021 GDP projections to be revised: Department of Statistics,1,2,1
Eight states with better growth track record: Statistics,1,1,1
The 2021 GDP projection will be reviewed - Department of Statistics,1,2,0
Please Continue To Aid The Rakyat With More Packages,1,1,1
Eight states recorded better growth,1,1,1
Eight states have a better performance record than the 5.6 percent contraction of national GDP in 2020,1,1,1
Eight states have better economic performance records,1,1,1
Eight states have better economic performance records,1,1,1
Eight states have a better performance record than the 5.6 percent contraction of national GDP in 2020,1,1,1
2021 GDP Projections Will Be Reexamined,1,2,1
The 2021 GDP projection will be reviewed - Department of Statistics,1,2,0
Eight states recorded better GDP performance than the national - DOSM,1,1,1
"Penang govt urged to assist SMEs, with Usahawan suggesting measures",1,2,1
"Penang govt urged to assist SMEs, with Usahawan suggesting measures",1,2,1
Political uncertainty to affect recovery effort,1,0,1
"MCO 3.0: Penang Muslim Entrepreneurs Organisation calls for state govt to help SMEs, suggests measures",1,1,1
The government guarantees automatic moratorium approval to those who qualify,1,1,1
The government guarantees automatic moratorium approval to those who qualify,1,1,1
SMEs need to be assisted in the National Recovery Plan,1,2,1
"Increased investment May convince investors to stay, creates employment, says DOSM",1,1,0
"Statistics Dept: Malaysia's increased investment may convince investors to stay, creating employment",1,1,1
"Save SMEs, avoid mass unemployment",1,0,0
"Save SMEs, avoid mass unemployment",1,0,0
Maybank continues to help affected customers,1,1,1
Sabah leads in sustainable oil palm,1,2,1
Malaysia's economy to further improve in the second quarter - DOSM,1,1,1
Statistics Dept sees Malaysia's economy further improving in Q2,1,1,1
Sabah makes strides towards sustainable palm oil production,1,2,1
Sabah Makes Strides Towards Sustainable Palm Oil Production,1,2,1
Uneven recovery,1,2,1
Statistics Dept: Malaysia's job market recovered in Q1 2021 but still down from pre-pandemic times,1,2,1
Statistics Dept: Malaysia's job market recovered in Q1 2021 but still down from pre-pandemic times,1,2,1
Statistics Dept: Malaysia's job market recovered in Q1 2021 but still down from pre-pandemic times,1,2,1
The government managed to stabilize the country's economy,1,2,1
The government managed to stabilize the country's economy,1,2,1
The State of the Nation: GDP will rebound in 2Q but MCO 3.0 may temper strength of recovery,1,1,1
The Y-AP concept accelerates the process of strengthening the role of the nation's youth,1,1,1
MCO 3.0 is not expected to have a significant impact on economic growth - Tengku Zafrul,1,1,1
MCO 3.0 is not expected to have a significant impact on economic growth - Tengku Zafrul,1,1,1
MCO 3.0 is not expected to have a significant impact on economic growth - Tengku Zafrul,1,1,1
MCO 3.0 not expected to greatly affect economic growth: Tengku Zafrul,1,1,1
MCO 3.0 is not expected to have a significant impact on economic growth,1,1,1
MCO 3.0 is not expected to have a significant impact on economic growth - Tengku Zafrul,1,1,1
"Focus on FDI quality, not quantity, says UM economist",1,2,0
M'sia needs solid base to support new wave digitalisation,1,1,1
MDEC: Malaysia needs solid foundation to support new wave digitalisation,1,1,1
MDEC sets lofty target for e-commerce adoption by 2025,1,2,1
The job market in Malaysia shows encouraging signs,1,1,1
The job market in Malaysia shows encouraging signs,1,1,1
Labor market shows encouraging signs - Economist,1,1,1
MicroLEAP: Establishing The Right Helping Hand For MSMEs Nationwide,1,1,1
The Tourism Dashboard monitors the achievements of the tourism sector,1,2,1
Noraini: Creative industry has potential to generate new sources of income,1,1,1
Creative industry has potential to generate new sources of income - Noraini,1,1,0
"Banknotes, coins in circulation grows over 14pct to RM130. 4bil in 2020: Bank Negara",1,2,1
Learn to value water today,1,1,1
Online petition launched urging govt to provide rental relief fund for SMEs,1,1,1
"Foreign labour influx a time bomb affecting Msia's future, well-being of the locals",1,0,1
"PAS and its ""partners of convenience"" should focus on real issues, not petty politics",1,1,0
"Pandemic magnifies income disparity, targeted aid needed",1,2,0
MIDA helps fintech startups partner with UK investment firms,1,1,1
MIDA helps Malaysian fintech start-ups partner with UK investment firms,1,1,1
A difficult year provided valuable experience for the Ministry of Finance to deal with the impact of COVID-19,1,1,1
A year of difficulty provides valuable experience for Malaysia's MOF to deaL with pandemic impact,1,1,1
A year of difficulty provides valuable experience for MOF to deal with pandemic impact,1,1,1
A difficult year gave the Ministry of Finance valuable experience in dealing with the impact of Covid-19,1,1,1
A difficult year provided valuable experience for the Ministry of Finance to deal with the impact of COVID-19,1,1,1
A year of difficulty provides valuable experience for MOF to deal with pandemic impact,1,1,1
Malaysia Builds Strong Investment Momentum In Digital And Tech Sector,1,1,1
Unregistered SMEs drop out of government aid,1,0,0
Unregistered SMEs drop out of government aid - Industries Unite,1,0,1
Unregistered SMEs drop out of government aid',1,0,0
Malaysian economy expected to turn positive this year on Covid-19 vaccine rollout,1,1,0
Malaysian economy expected to turn positive this year on Covid-19 vaccine roll out,1,1,0
Statistics Dept: Malaysian economy expected to turn positive this year on Covid-19 vaccine rollout,1,1,0
Malaysia builds strong investment momentum in the digital and tech sector,1,1,1
"Expanding economic pie will ensure fairer, more inclusive growth for all",1,1,1
M'sian economy to recover on effective vaccine deployment: WB,1,1,1
Creating a talent pool for tech sector,1,1,1
"Economy to recover this year on effective vaccine deployment, says World Bank",1,1,1
"Malaysian economy to recover in 2021 on effective vaccine deployment, says World Bank",1,1,1
World Bank: Malaysia GDP to recover in 2021 on effective vaccine deployment,1,1,1
"Malaysian economy to recover in 2021 on effective vaccine deployment, says World Bank",1,1,1
Digital skills key to bolstering workforce innovation,1,1,1
Malaysia builds strong investment momentum in digital and tech sector,1,1,1
"Malaysian economy to recover in 2021 on effective vaccine deployment, says World Bank",1,1,1
"MDEC: For the good of M'sia, we absolutely support MyDigital",1,1,1
Digital skills are crucial to bolster workforce innovation,1,1,1
"Industry, government work together to provide digital training",1,2,1
Regulation of RM2.27 billion vape industry will benefit local SMEs,1,1,1
Graduate research assistant allowance increases according to academic qualifications,1,2,1
The State of the Nation: New approaches needed to tackle unemployment in 2021,1,0,1
Thriving in the new norm with cloud & AI,1,2,1
DoSM'S My Local Stats eases search for statistics,1,1,0
Diversifying Malaysia's agro-food sector as the way to stimulate agricultural development,1,1,1
Sabah's experience in the unprecedented year of 2020,1,2,1
Sabah's experience in unprecedented 2020,1,2,1
Reflection: Sabah's experience in unprecedented 2020,1,2,1
2021: Recovery towards normalcy,1,2,1
Changes needed for Labuan's economic recovery,1,2,1
2020 is the most bitter challenge for the country's economy,2,0,0
2020 is the most bitter challenge for the country's economy,2,0,0
Not all is doom and gloom for Malaysians for the year 2020,2,0,1
Not all doom and gloom for Malaysians in 2020,2,0,0
Not all doom and gloom for Malaysians in 2020,2,0,0
Not all doom and gloom for Malaysians in 2020,2,0,0
Economic recovery likely in early months of 2021 - DoSM,2,2,1
Economic recovery likely in early months of 2021 - DoSM,2,2,1
"Economic recovery likely in early months of 2021, says DOSM",2,2,1
Statistics Dept sees Malaysia's economic recovery gathering pace in early months of 2021,2,2,1
Economic recovery likely in early months of 2021 - DoSM,2,2,1
Statistics Dept sees Malaysia's economic recovery gathering pace in early months of 2021 | Money,2,2,1
SMEs in Sabah need a bigger allocation,2,2,1
Would Covid pandemic change our way of life and minds? - Boo Cheng Hau,2,2,1
"Assistance incentives, the 2020 challenge to raise the spirit of PKS to boost competitiveness",2,1,1
"Govt assist SMEs to survive, boost competitiveness amid Covid-19 economy",2,1,1
"SMEs given billions of ringgit in assistance to survive, boost competitiveness",2,1,1
"Assistance incentives, the 2020 challenge to raise the spirit of PKS to boost competitiveness",2,1,1
"SMEs given billions of ringgit in assistance to survive, boost competitiveness",2,1,1
"As global economy goes down, gig economy rises",2,2,1
"Effects of COVID-19 pandemic on rubber, pepper and cocoa industry",2,2,0
"Ups and downs of rubber, pepper & cocoa industry",2,2,1
"Ups and downs of rubber, pepper & cocoa industry",2,2,1
An additional economic stimulus package of RM45 billion is needed,2,2,1
Budget 2021: DAP proposes a RM45 billion stimulus package,2,2,0
Tech event expected to bring RM500m economic boost,2,1,1
Use data driven approach for policy making,2,2,1
Now's the time to go into business,2,2,1
Rebuild the tourism economy,2,2,1
Research houses mixed on Malaysia's 2021 OPR outlook,2,2,1
MEDAC to boost SME businesses via e-commerce platform,2,1,1
The green zone domestic travel bubble initiative is the government's effort to recover the tourism sector,2,2,1
M'sia's GDP at -2.7pc in 3Q20: DOSM,2,2,1
Growth trajectory on track: BNM,2,1,1
DOSM: Malaysia's GDP at -2.7 pct in 3Q20,2,2,1
2021 growth trajectory on track despite CMCO,2,1,1
Bank Negara: Foreign investors not turning away from Malaysia despite RM0.8b FDI outflow in Q3 2020; private investment growth to rebound in 2021,2,1,0
Bank Negara warns against debt-fuelled economic growth,2,1,1
Malaysia's GDP at -2.7 pct in third quarter - Statistics dept,2,2,1
Growth trajectory for 2021 on track despite CMCO - BNM governor,2,1,1
Malaysia's GDP at -2.7% in 3Q20 - DOSM,2,2,1
Q3 GDP at -2.7,2,2,1
Malaysia's GDP at -2.7 pct in 3Q20 -- DOSM,2,2,1
Growth trajectory for 2021 on track despite CMCO - BNM Governor,2,1,1
Growth trajectory for 2021 on track despite CMCO -- BNM Governor,2,1,1
Invest in healthcare and education sectors to mitigate underemployment -- REFSA,2,2,1
Cover Story: All hands on deck for Sabah,2,2,1
Why Sabah is struggling to contain its Covid-19 crisis,2,0,0
PIKOM calls for digital transformation inclusivity in Budget 2021,2,2,1
"The Week Ahead: Malaysian politics, US 3Q GDP and meeting of China's top leaders in focus",2,1,1
A different approach to retirement investing,2,2,1
GDP forecast to reach -4.4% due to CMCO,2,1,1
Online Daily News : Selangor highlights PKS efforts to deal with the impact of COVID-19,2,2,1
Selangor is highlighting PKS' efforts to deal with the impact of COVID-19,2,2,1
Numbers That Need To Be Observed - Syahir Sulaiman,2,2,0
Selangor launch video series on MSMEs' survival during Covid-19 pandemic,2,2,1
Numbers That Need To Be Observed - Syahir Sulaiman,2,2,0
The numbers to watch,2,2,1
"Thus ends Sabah distraction, next stop - the recession",2,0,0
"Upward trend in LI boost consumer, investor sentiment - Economists",2,1,1
"Upward trend in LI boost consumer, investor sentiment -- Economists",2,1,1
The State of the Nation: The reopening-of-borders conundrum,2,2,0
PM: Collective action of international community key to recovery from Covid-19,2,2,1
Collective action of international community key to recovery from Covid-19 - Muhyiddin,2,2,1
Collective action of international community key to recovery from COVID-19 -- Muhyiddin,2,2,1
Collective action of international community key to recovery from COVID-19 - Muhyiddin,2,2,1
Collective action of international community key to recovery from Covid-19 - Muhyiddin,2,2,1
Muhyiddin: Collective action of international community key to recovery from Covid-19,2,2,1
Government announces RM10bil Kita Prihatin package,2,2,1
Govt announces RM10 billion Kita Prihatin package,2,2,1
Govt announces RM10bln Kita Prihatin package,2,2,1
Govt announces RM10 bln KITA PRIHATIN Package,2,2,1
Govt annnounces RM10b Kita Prihatin package,2,2,1
Sabah a new economic power? It's okay,2,1,1
Tending to matters of the heart,2,1,1
Domestic tourism grows 12 pct to RM92.6 bln in 2019 - DOSM,2,2,1
Domestic tourism grows 12% to RM92.6 bln in 2019 - DOSM,2,2,1
Domestic tourism increased 12 percent,2,1,1
Domestic tourism grows 12 per cent to RM92.6 bln in 2019 - DOSM,2,2,1
Domestic tourism grows 12 per cent to RM92.6 bln in 2019 - DOSM,2,2,1
Domestic tourism 2019 increased,2,1,1
Domestic tourism increased 12 percent to RM92.6 bln in 2019 -- DOSM,2,1,1
Domestic tourism grows 12 percent to RM92.6B in 2019 - DOSM,2,2,1
Discordant shopping activity 42.1 percent,2,2,1
Analyst: M'sia set for economic rebound in Q3,2,2,1
The stimulus package proved successful in absorbing the impact of Covid-19,2,1,1
Malaysia set for economic rebound in Q3 - Analyst,2,2,1
Malaysia set for economic rebound in Q3 - Analyst,2,2,1
Belanjawan Selangor 2021: A clarion call to action,2,2,1
Buy Malaysian Goods Campaign (KBBM) 2020,2,2,1
Malaysian-made goods stimulate the domestic economy,2,1,1
The Buy Malaysia Goods campaign boosts the economy,2,1,1
Malaysian Made Goods stimulate the domestic economy,2,1,1
Pivot towards digital economy amid Covid-19 outbreak,2,2,1
Extending RM100 million in financing to assist SMEs,2,2,1
Find an antidote to the 'al-gharimin' cluster before it's too late,2,2,0
The government continues the PKPP without extending the moratorium - questions Guan Eng,2,2,1
Lim questioned the government extending the PKPP without additional economic aid,2,0,0
Guan Eng calls out PM for extending RMCO without economic provisions,2,2,1
Lim questioned the government extending the PKPP without additional economic aid,2,0,0
Independents might be kingmakers in Sabah state election,2,2,1
Sabah votes 2020: Tough battle ahead - Jason Loh,2,0,1
"As uncertainty grips economy, urgent need to protect the vulnerable",2,1,1
Malaysia's efforts in dealing with the COVID-19 pandemic,2,2,1
Labor productivity per employee fell 16 percent in the second quarter of 2020 - Department of Statistics,2,2,0
Labour productivity per person employed down 16 pct in Q2 2020 - DOSM,2,2,1
Exabytes launches Sama-Sama Digital to spur Bumiputera SMEs to digitalise,2,2,1
Exabytes launches Sama-Sama Digital to spur Bumiputera SMEs to digitalise,2,2,1
Statistics Dept: Labour productivity per person employed down 16pc in Q2 2020,2,2,1
Labour productivity per person employed down 16 pct in Q2 2020 - DOSM,2,2,1
"Revive the economy, the allocation should be higher - Anwar",2,1,1
Malaysia is headed for a severe economic recession unless Perikatan Nasional does this one thing,2,0,1
"While Becoming Minister of Finance, Ask the People to Tie Up Their Stomachs, Be Independent (read stingy)",2,2,0
"Malaysia needs a post-Covid-19 stimulus package, says Lim",2,2,1
Another RM45b stimulus package needed to battle recession - Guan Eng,2,0,1
Sabah's GDP under Shafie plunged badly - Hajiji,2,0,0
"Sabah's economy is sluggish, GDP 0.5 percent under the Warisan-Hajiji administration",2,0,1
Another economic stimulus package of RM45b is needed - Guan Eng,2,2,1
"Sabah's economy is sluggish, GDP 0.5 percent under the Warisan-Hajiji administration",2,0,1
Ex-finance minister urges decisive Putrajaya intervention to stave off economic death spiral,2,0,1
The country needs another stimulus package to avoid economic recession - Guan Eng,2,0,0
Another RM45b stimulus package needed to battle recession - Guan Eng,2,0,1
"MTUC to Putrajaya: Stop painting rosy economic picture, time for reality check",2,0,0
The rise of the Malaysian economy,2,2,1
"MTUC to Putrajaya: Stop painting rosy economic picture, time for reality check",2,0,0
GDP nosedives in Q2 due to economic pause in April,2,2,1
"Malaysia's GDP falls 17.1% in 2Q20, lowest since 1998",2,0,1
GDP shrank 17.1 percent in the second quarter of 2020,2,2,1
GDP -17.1 percent is not in line with the national unemployment rate - Economic analysts,2,0,0
Jobs in private sector down to 8.4m in 2Q,2,2,0
Employment in the private sector declined to 8.4 million in the second quarter,2,2,0
The number of jobs in the private sector decreased,2,1,0
Second quarter growth is expected to be negative but shows a recovery,2,0,1
"Selangor recorded high GDP per capita, exceeds national level",2,2,1
Mission to drive Sabah back on track: Musa,2,2,1
The hard work of the Kelantan GDP surge officer,2,0,1
"Sabah's steering mission is back on track, said Musa Aman",2,2,1
Sabah Steering Mission Back to the Right Track - Musa Aman,2,2,1
"Sabah Will Continue To Be Left Behind Under Shafie's Leadership, Said Musa",2,2,1
"Steer Sabah back to right path, says Musa Aman | The Edge Markets",2,2,1
Sabah steering mission back on track - Musa Aman,2,2,1
Driving Sabah back to the right track,2,2,1
Unite to free Sabah from economic oppression: Musa,2,1,1
"Sabah will continue to fall behind under Shafie's leadership, said Musa",2,2,1
Driving Sabah back to the right track,2,2,1
How steep will Malaysia's 2Q20 GDP contraction be,2,2,1
"Various measures taken for state GDP growth amid pandemic situation, says Melaka CM",2,1,1
